[
  {
    "id": "bc81c7e2-6971-4553-a4f8-47754eec9365",
    "typ_dokladu": "Přijatá faktura",
    "částka_bez_dph": {
      "výše": 1000.1,
      "měna": "CZK"
    },
    "částka_s_dph": {
      "výše": 1000.1,
      "měna": "CZK"
    },
    "částka_uhrazená": {
      "výše": 1000.1,
      "měna": "CZK"
    },
    "částka_celkem_devizy": {
      "výše": 1000.1,
      "měna": "EUR"
    },
    "datum_úhrady": "2019-01-01",
    "datum_vystavení": "2019-01-01",
    "datum_splatnosti": "2019-01-01",
    "datum_přijetí": "2019-01-01",
    "datum_plnění": "2019-01-01",
    "identifikátor_dodavatele": "ABCD123",
    "identifikátor_odběratele": "DCBA123",
    "účel_platby": "Rekonstrukce chodníku",
    "url": "https://doklady.cz/faktury/1234",
    "identifikátor_smlouvy": "AA-1564896489",
    "kapitola_rozpočtu": [
      {
        "číslo": "303",
        "název": "Senát Parlamentu"
      },
      {
        "číslo": "301",
        "název": "Kancelář prezidenta republiky"
      }
    ],
    "dodavatel": {
      "osoba": {
        "název": "Kosovská banka",
        "stát_registrace": {
          "kód": "1A0",
          "název": "Kosovo"
        }
      }
    },
    "odběratel": {
      "osoba": {
        "ičo": "00024341",
        "název": "Ministerstvo zdravotnictví"
      }
    },
    "položka_faktury": [
      {
        "název": "Písek",
        "množství": {
          "hodnota": 23.0,
          "jednotka": "KGM"
        },
        "částka_bez_dph_jednotka": {
          "výše": 1024.12,
          "měna": "CZK"
        },
        "částka_bez_dph_celkem": {
          "výše": 23554.76,
          "měna": "CZK"
        },
        "sazba_dph": 1.21,
        "položka_rozpočtu": [
          {
            "číslo": "1111",
            "název": "Daň z příjmů fyzických osob placená plátci"
          }
        ],
        "analytický_účet": [
          {
            "číslo": "511/100",
            "název": "Náklady na reprezentaci"
          }
        ]
      },
      {
        "název": "Jiný písek",
        "množství": {
          "hodnota": 23.0,
          "jednotka": "KGM"
        },
        "částka_bez_dph_jednotka": {
          "výše": 1024.12,
          "měna": "CZK"
        },
        "částka_bez_dph_celkem": {
          "výše": 23554.76,
          "měna": "CZK"
        },
        "sazba_dph": 1.21,
        "položka_rozpočtu": [
          {
            "číslo": "1111",
            "název": "Daň z příjmů fyzických osob placená plátci"
          }
        ],
        "analytický_účet": [
          {
            "číslo": "511/100",
            "název": "Náklady na reprezentaci"
          }
        ]
      }
    ]
  }
]